<?xml version="1.0" encoding="utf-8"?>
<!DOCTYPE VCARDBATCH SYSTEM "http://giobeatle1794.esy.es/app_data/batch/pdk_1.0/vcardbatch.dtd">

<vCardBatch dtd="y">
<main>
	<name origin="italian" mean="Misericordia de Dios">Giovanny</name>
	<2name origin="greek" mean="PacÃ­fico">Alfredo</2name>
	<lname born="f-m">Garciliano Diaz</lname>
	<born num="1" calendar="greg">
		<day>20</day>
		<month>09</month>
		<year>2001</year>
		<hour>15</hour>
		<min>45</min>
	</born>
</main>
<address>
	<street type="c">Matamoros</street>
	<numhouse int="2">114</numhouse>
	<suburb zip="86120">Guadalupe Borja de D&iacute;az</suburb>
	<city>Villahermosa</city>
	<state>Tabasco</state>
	<country>M&eacute;xico</country>
</address>
<communication>
	<email>
		<homee server="Microsoft" service="Hotmail/Outlook">xivanni@hotmail.com</homee>
		<worke server="Google" service="Gmail">giobeatle10@gmail.com</workee>
		<cele server="*" service="*">*</cele>
		<othere server="*" service="*">*</othere>
	</email>
	<tel>
		<celt lade="52">9931954420</celt>
		<homet>*</homet>
		<nett>*</nett>
		<loct>*</loct>
		<othert>*</othert>
	</tel>
	<otherc>
		<website ip="31.170.165.6">http://giobeatle1794.esy.es/</website>
	</otherc>
</communication>
<hobbies>
	<likes>
		<music>English, Rock n' roll, pop, etc</music>
		<art>The ASCII Art</art>
		<sport>I hate sports, except chess</sport>
		<food>Veganism</food>
		<life>A empresary</life>
		<who enc="Base64">QWxvbmRyYQ</who>
		<color>Black, White</color>
		<schedule>Informatic</schedule>
		<moreay>*</moreay>
	</likes>
	<activities>
		<preferences>Computer, Reading, Programming</preferences>
		<projects>A programs PC</projects>
	</activities>
	<otherh>*</otherh>
</hobbies>
<file>
	<progsrc gt="y"/>
	<prog version="1.0">PC Garcil&reg; XML-ID Maker</nameprog>
	<instdir>%instdir%</instdir>
</file>
</vCardBatch>
